<?xml version="1.0"?>
<xs:schema xmlns:xs="http://www.w3.org/2001/XMLSchema">
<!-- Definition of main"note"element -->
    <xs:element name="note">
        <xs:complexType>
            <xs:sequence>
                <xs:element name="to" type="xs:string"/>
                <xs:element name="from" type="xs:string"/>
                <xs:element name="heading" type="xs:string"/>
                <xs:element name="body" type="xs:string"/>
                <xs:element name="date" type="xs:string">
                <xs:element name="priority" type="xs:decimal">
                <xs:element name="urgent" type="xs:boolean">
            </xs:sequence>
            <!-- An attribute with a enumerated type  -->
            <xs:attribute name="id" type"xs:positiveInteger">
        </xs:complexType>
    </xs:element>
</xs:schema>

