<?xml version="1.0"?>
<note xmlns:xsi ="http://www.w3org/2001/XMLSchema-instance" xsi:noNamespaceSchemaLocation="note.xsd"
id="1001">
    <to>Shyam</to>
    <from>Ram</from>
    <heading>Meeting</heading>
    <body>Dont forget tomorrow.</body>
    <date>2026-03-30</date>
    <priority>3.5</priority>
    <urgent>false</urgent>
</note>
